{
  "packId": "logsense-identity-resolution-pack",
  "version": "0.1.0",
  "rules": [
    {
      "ruleId": "IDR-001",
      "version": "0.1.0",
      "method": "EXACT_NATIVE_ID",
      "entityTypes": [
        "HUMAN_PRINCIPAL",
        "SERVICE_PRINCIPAL",
        "ORGANIZATION",
        "AI_SYSTEM",
        "AI_AGENT",
        "AGENT_INSTANCE",
        "MODEL",
        "WORKFLOW",
        "TASK",
        "INTENT",
        "GOAL",
        "MESSAGE",
        "PROMPT",
        "CONTEXT",
        "MEMORY_STORE",
        "MEMORY_ENTRY",
        "RETRIEVAL_QUERY",
        "KNOWLEDGE_SOURCE",
        "RETRIEVED_DOCUMENT",
        "TOOL",
        "MCP_SERVER",
        "MCP_RESOURCE",
        "MCP_PROMPT",
        "API",
        "OPERATION",
        "POLICY",
        "GUARDRAIL",
        "AUTHORIZATION_DECISION",
        "DELEGATION",
        "CREDENTIAL",
        "CAPABILITY",
        "RESOURCE",
        "STATE_PROPERTY",
        "STATE_OBSERVATION",
        "KPI",
        "ALARM",
        "INCIDENT",
        "ARTIFACT",
        "BUILD",
        "DEPLOYMENT",
        "CONTAINER",
        "WORKLOAD",
        "QUEUE_TOPIC",
        "NETWORK_ENDPOINT",
        "EVIDENCE_SOURCE",
        "EVIDENCE_RECORD",
        "CAUSE_CLASS",
        "REMEDIATION",
        "VERIFICATION_TEST",
        "SERVICE",
        "NETWORK_FUNCTION",
        "ODA_COMPONENT",
        "UNKNOWN",
        "CellSite",
        "NetworkCell",
        "Sector",
        "TrackingArea",
        "UE_Device",
        "UE_Session",
        "NetworkSlice",
        "SliceSubnet",
        "SliceIsolationPolicy",
        "QoS_Flow",
        "NetworkFunction",
        "SBI_Transaction",
        "NRF_Registration",
        "SCP_Route",
        "NF_Communication_Pattern",
        "TransportLink",
        "PacketSession"
      ],
      "requiredMatchFields": [
        "externalId"
      ],
      "requiredScopeFields": [
        "provider",
        "environment",
        "domain"
      ],
      "forbiddenMatchBases": [
        "DISPLAY_NAME",
        "FUZZY_SIMILARITY",
        "AI_ONLY_ALIAS"
      ],
      "outputState": "EXACT",
      "hardNegatives": [
        "DISPLAY_NAME != IDENTITY",
        "NAME_SIMILARITY != IDENTITY_BINDING"
      ],
      "haiecReferences": [
        "lib/evidence/evidence-contract.ts",
        "lib/evidence/identity-continuity.ts"
      ],
      "limitations": []
    },
    {
      "ruleId": "IDR-002",
      "version": "0.1.0",
      "method": "COMPOSITE_IDENTITY",
      "entityTypes": [
        "HUMAN_PRINCIPAL",
        "SERVICE_PRINCIPAL",
        "ORGANIZATION",
        "AI_SYSTEM",
        "AI_AGENT",
        "AGENT_INSTANCE",
        "MODEL",
        "WORKFLOW",
        "TASK",
        "INTENT",
        "GOAL",
        "MESSAGE",
        "PROMPT",
        "CONTEXT",
        "MEMORY_STORE",
        "MEMORY_ENTRY",
        "RETRIEVAL_QUERY",
        "KNOWLEDGE_SOURCE",
        "RETRIEVED_DOCUMENT",
        "TOOL",
        "MCP_SERVER",
        "MCP_RESOURCE",
        "MCP_PROMPT",
        "API",
        "OPERATION",
        "POLICY",
        "GUARDRAIL",
        "AUTHORIZATION_DECISION",
        "DELEGATION",
        "CREDENTIAL",
        "CAPABILITY",
        "RESOURCE",
        "STATE_PROPERTY",
        "STATE_OBSERVATION",
        "KPI",
        "ALARM",
        "INCIDENT",
        "ARTIFACT",
        "BUILD",
        "DEPLOYMENT",
        "CONTAINER",
        "WORKLOAD",
        "QUEUE_TOPIC",
        "NETWORK_ENDPOINT",
        "EVIDENCE_SOURCE",
        "EVIDENCE_RECORD",
        "CAUSE_CLASS",
        "REMEDIATION",
        "VERIFICATION_TEST",
        "SERVICE",
        "NETWORK_FUNCTION",
        "ODA_COMPONENT",
        "UNKNOWN",
        "CellSite",
        "NetworkCell",
        "Sector",
        "TrackingArea",
        "UE_Device",
        "UE_Session",
        "NetworkSlice",
        "SliceSubnet",
        "SliceIsolationPolicy",
        "QoS_Flow",
        "NetworkFunction",
        "SBI_Transaction",
        "NRF_Registration",
        "SCP_Route",
        "NF_Communication_Pattern",
        "TransportLink",
        "PacketSession"
      ],
      "requiredMatchFields": [
        "resourceType",
        "externalId"
      ],
      "requiredScopeFields": [
        "provider",
        "environment"
      ],
      "forbiddenMatchBases": [
        "DISPLAY_NAME",
        "AI_ONLY_ALIAS"
      ],
      "outputState": "EXACT",
      "hardNegatives": [
        "ABSENT_COMPONENT != GUESSED_MATCH"
      ],
      "haiecReferences": [
        "lib/evidence/evidence-contract.ts"
      ],
      "limitations": []
    },
    {
      "ruleId": "IDR-003",
      "version": "0.1.0",
      "method": "APPROVED_ALIAS",
      "entityTypes": [
        "HUMAN_PRINCIPAL",
        "SERVICE_PRINCIPAL",
        "ORGANIZATION",
        "AI_SYSTEM",
        "AI_AGENT",
        "AGENT_INSTANCE",
        "MODEL",
        "WORKFLOW",
        "TASK",
        "INTENT",
        "GOAL",
        "MESSAGE",
        "PROMPT",
        "CONTEXT",
        "MEMORY_STORE",
        "MEMORY_ENTRY",
        "RETRIEVAL_QUERY",
        "KNOWLEDGE_SOURCE",
        "RETRIEVED_DOCUMENT",
        "TOOL",
        "MCP_SERVER",
        "MCP_RESOURCE",
        "MCP_PROMPT",
        "API",
        "OPERATION",
        "POLICY",
        "GUARDRAIL",
        "AUTHORIZATION_DECISION",
        "DELEGATION",
        "CREDENTIAL",
        "CAPABILITY",
        "RESOURCE",
        "STATE_PROPERTY",
        "STATE_OBSERVATION",
        "KPI",
        "ALARM",
        "INCIDENT",
        "ARTIFACT",
        "BUILD",
        "DEPLOYMENT",
        "CONTAINER",
        "WORKLOAD",
        "QUEUE_TOPIC",
        "NETWORK_ENDPOINT",
        "EVIDENCE_SOURCE",
        "EVIDENCE_RECORD",
        "CAUSE_CLASS",
        "REMEDIATION",
        "VERIFICATION_TEST",
        "SERVICE",
        "NETWORK_FUNCTION",
        "ODA_COMPONENT",
        "UNKNOWN",
        "CellSite",
        "NetworkCell",
        "Sector",
        "TrackingArea",
        "UE_Device",
        "UE_Session",
        "NetworkSlice",
        "SliceSubnet",
        "SliceIsolationPolicy",
        "QoS_Flow",
        "NetworkFunction",
        "SBI_Transaction",
        "NRF_Registration",
        "SCP_Route",
        "NF_Communication_Pattern",
        "TransportLink",
        "PacketSession"
      ],
      "requiredMatchFields": [
        "approvedAlias"
      ],
      "requiredScopeFields": [
        "caseId"
      ],
      "forbiddenMatchBases": [
        "AI_ONLY_ALIAS",
        "FUZZY_SIMILARITY"
      ],
      "outputState": "EXACT",
      "hardNegatives": [
        "AI_PROPOSAL != APPROVED_ALIAS"
      ],
      "haiecReferences": [
        "lib/evidence/identity-continuity.ts"
      ],
      "limitations": [
        "ANALYST_DECISION_REQUIRED"
      ]
    }
  ],
  "digest": "cf6bd55f25c2d789ca459c9bdaf92cc1dc0edb90ca87795a05df33651d253b98"
}